{
    "id": "002-crud-ticket-tag",
    "category": "crud_addition",
    "size_estimate": "m",
    "prompt_file": "002-crud-ticket-tag.prompt.md",
    "max_iterations": 3,
    "max_wall_clock_s": 1800,
    "success_criteria": [
        {"type": "phpunit"},
        {"type": "smoke_no_regressions"},
        {"type": "file_exists", "paths": [
            "mock-project/src/Domain/Entity/Tag.php",
            "mock-project/src/Domain/Repository/TagRepository.php"
        ]},
        {"type": "diff_size_limit", "max_lines": 600}
    ]
}
