{
    "id": "006-intermittent-test-bugfix",
    "category": "bugfix_root_cause",
    "size_estimate": "l",
    "prompt_file": "006-intermittent-test-bugfix.prompt.md",
    "max_iterations": 3,
    "max_wall_clock_s": 2400,
    "success_criteria": [
        {"type": "phpunit", "filter": "RecentActivityServiceTest", "runs": 10},
        {"type": "phpunit"},
        {"type": "smoke_no_regressions"}
    ]
}
