{
    "id": "004-sla-deadline-migration",
    "category": "migration_backfill",
    "size_estimate": "m",
    "prompt_file": "004-sla-deadline-migration.prompt.md",
    "max_iterations": 3,
    "max_wall_clock_s": 1800,
    "success_criteria": [
        {"type": "phpunit"},
        {"type": "smoke_no_regressions"},
        {"type": "diff_size_limit", "max_lines": 200}
    ]
}
